{
  "$schema": "../../schema/profanity.schema.json",
  "_doc": "27 §1 — the English half of the name filter, applied to the 07 §1 hero name at creation and on every edit. A SEED, not a curated list: twelve high-precision terms, chosen so that the substring match they drive has as few innocent collisions as possible. Terms deliberately LEFT OUT for that reason, and recorded so the next author does not re-derive the decision: 'rape' (grape, drape, scrape), 'ass' (class, bass, pass, brass), 'dick' (Dickens, Dickinson, a real surname), 'hell' and 'damn' (mild, and the design set nowhere asks for them). 'cunt' is kept although it is the canonical false-positive example (Scunthorpe): the term is severe enough that a refusal is the safer error, and the 12-character hero-name limit makes the colliding place names unreachable anyway. KNOWN GAP FOR THE CURATOR: the matcher collapses repeated letters in the CANDIDATE but not in the TERM, so a stretched spelling of a term that itself doubles a letter is not caught -- 'faggot', 'nigga' and 'nigger' are the three seeded terms this affects. The asymmetry is deliberate (collapsing the term shortens it into strings ordinary names contain) and the cost is recorded here rather than hidden.",
  "_status": "partial",
  "language": "EN",
  "curation": {
    "state": "SEED",
    "owner": "M17",
    "maxSeedTerms": 24
  },
  "terms": [
    "bastard",
    "bitch",
    "cunt",
    "faggot",
    "fuck",
    "nigga",
    "nigger",
    "shit",
    "slut",
    "twat",
    "wanker",
    "whore"
  ]
}
